{
  "dsl": "vringon-shaft/1.0",
  "id": "taper-shaft",
  "name": "Taper shaft with keyway",
  "name_ko": "테이퍼 축",
  "part_class": "shaft",
  "units": "mm",
  "material": "SCM440",
  "drawing": {
    "number": "VR-RB-009",
    "scale": "1:1",
    "projection": "third"
  },
  "segments": [
    {
      "type": "cyl",
      "length": 35,
      "diameter": 25,
      "tolerance": "k6"
    },
    {
      "type": "taper",
      "length": 40,
      "d_start": 25,
      "d_end": 20
    },
    {
      "type": "thread",
      "length": 20,
      "diameter": 16,
      "spec": "M16x1.5",
      "pitch": 1.5
    }
  ],
  "transitions": [
    {
      "at": 0,
      "type": "chamfer",
      "size": 1
    },
    {
      "at": 3,
      "type": "chamfer",
      "size": 1.5
    },
    {
      "at": 2,
      "type": "undercut",
      "width": 4.5,
      "depth": 1.1,
      "standard": "DIN 76-A"
    }
  ],
  "grooves": [],
  "bore": null,
  "features": [
    {
      "type": "keyway",
      "segment": 0,
      "offset": 8,
      "length": 20,
      "width": 8,
      "depth": 4,
      "kind": "parallel",
      "standard": "DIN 6885 8×7"
    },
    {
      "type": "center_hole",
      "end": "left",
      "form": "A",
      "d": 2.5
    }
  ],
  "meta": {
    "source": "golden",
    "difficulty": 4
  }
}